{
  "id": "hero.main",
  "category": "CTA",
  "label": "Main",
  "tag": "main",
  "purpose": "Conversion block of the contact pages: a heading, contact-channel links and the demo-request / support form.",
  "purposeIsInferred": false,
  "nameSource": "data-attr",
  "evidence": {
    "level": "measured",
    "instances": 2,
    "routes": 2,
    "measuredFrom": [
      "src/sections/Main.jsx:6-171",
      "src/sections/Main2.jsx:6-126"
    ],
    "measuredIn": "the runnable clone's own source (src/sections/*.jsx); see extraction/measured-values.json"
  },
  "content": {
    "additionalProperties": false,
    "fields": {
      "heading": {
        "type": "string",
        "required": true,
        "maxWords": 2
      },
      "body": {
        "type": "string[]",
        "required": true,
        "maxItems": 11,
        "maxWords": 16
      },
      "ctas": {
        "type": "cta[]",
        "required": true,
        "maxItems": 1,
        "maxWords": 2
      }
    }
  },
  "constraints": {
    "onePerPage": true
  },
  "motion": {
    "allowedPatterns": [
      "appear-on-enter",
      "css-transition",
      "none"
    ],
    "reducedMotionFallback": "disable-animation"
  },
  "responsive": {
    "measuredAt": {
      "desktop": "1440px",
      "mobile": "390px"
    },
    "breakpoints": "tokens/00-foundation/breakpoint.json",
    "desktop": {
      "heightPx": 1173,
      "columns": 1,
      "heightSource": "max over routes of extraction/measured-values.json sectionHeights (1440px, built clone)"
    },
    "mobile": {
      "heightPx": 1229,
      "columns": 1,
      "hiddenShare": 0
    },
    "changes": []
  },
  "assetRoles": [],
  "implementedBy": "src/sections/Main.jsx",
  "semantic": {
    "id": "hero.main",
    "category": "CTA"
  },
  "source": {
    "id": "Main",
    "tag": "main",
    "file": "src/sections/Main.jsx",
    "lines": [
      6,
      171
    ]
  },
  "retrievalEligible": true,
  "generatedAssetRoles": []
}
