{
  "id": "cta.cta-section-2",
  "category": "CTA",
  "label": "CTA Section #2",
  "tag": "section",
  "purpose": "Converts: prompts a single clear next action. Example headline: \"Go live in days and get paid in a week\".",
  "purposeIsInferred": true,
  "nameSource": "data-attr",
  "evidence": {
    "level": "measured",
    "instances": 1,
    "routes": 1,
    "measuredFrom": [
      "src/sections/CTASection2.jsx:6-147"
    ],
    "measuredIn": "the runnable clone's own source (src/sections/*.jsx); see extraction/measured-values.json"
  },
  "content": {
    "additionalProperties": false,
    "fields": {
      "heading": {
        "type": "string",
        "required": true,
        "maxWords": 10
      },
      "body": {
        "type": "string[]",
        "required": true,
        "maxItems": 2,
        "maxWords": 4
      },
      "ctas": {
        "type": "cta[]",
        "required": true,
        "maxItems": 1,
        "maxWords": 3
      },
      "items": {
        "type": "item[]",
        "required": true,
        "maxItems": 4,
        "titleMaxWords": 1,
        "bodyMaxWords": 13
      },
      "images": {
        "type": "image[]",
        "required": false,
        "maxItems": 1,
        "assetRoles": [
          "content-image"
        ]
      }
    }
  },
  "constraints": {
    "onePerPage": true
  },
  "motion": {
    "allowedPatterns": [
      "appear-on-enter",
      "none"
    ],
    "reducedMotionFallback": "disable-animation"
  },
  "responsive": {
    "measuredAt": {
      "desktop": "1440px",
      "mobile": "390px"
    },
    "breakpoints": "tokens/00-foundation/breakpoint.json",
    "desktop": {
      "heightPx": 565,
      "columns": 2,
      "heightSource": "max over routes of extraction/measured-values.json sectionHeights (1440px, built clone)"
    },
    "mobile": {
      "heightPx": 937,
      "columns": 2,
      "hiddenShare": 0
    },
    "changes": [
      "grows taller on mobile (content stacks)"
    ]
  },
  "assetRoles": [
    "content-image"
  ],
  "implementedBy": "src/sections/CTASection2.jsx",
  "semantic": {
    "id": "cta.cta-section-2",
    "category": "CTA"
  },
  "source": {
    "id": "CTASection2",
    "tag": "section",
    "file": "src/sections/CTASection2.jsx",
    "lines": [
      6,
      147
    ]
  },
  "retrievalEligible": true,
  "generatedAssetRoles": [
    "generated-illustration",
    "placeholder-screenshot",
    "user-supplied-asset"
  ]
}
