{
  "id": "content.legal-clause",
  "category": "CONTENT",
  "label": "Legal Clause",
  "tag": "h3",
  "purpose": "One heading-bounded clause of a legal document (a numbered <h3> heading and the paragraphs and lists under it, up to the next clause).",
  "purposeIsInferred": false,
  "nameSource": "data-attr",
  "evidence": {
    "level": "measured",
    "instances": 34,
    "routes": 2,
    "measuredFrom": [
      "src/sections/ContentSection2.jsx:33-37",
      "src/sections/ContentSection2.jsx:38-45",
      "src/sections/ContentSection2.jsx:46-58",
      "src/sections/ContentSection2.jsx:59-68",
      "src/sections/ContentSection2.jsx:69-87"
    ],
    "measuredIn": "the runnable clone's own source (src/sections/*.jsx); see extraction/measured-values.json"
  },
  "content": {
    "additionalProperties": false,
    "fields": {
      "heading": {
        "type": "string",
        "required": true,
        "maxWords": 7
      },
      "body": {
        "type": "string[]",
        "required": true,
        "maxItems": 50,
        "maxWords": 1101
      }
    }
  },
  "constraints": {
    "maxPerPage": 20
  },
  "motion": {
    "allowedPatterns": [
      "none"
    ],
    "reducedMotionFallback": "disable-animation"
  },
  "responsive": {
    "measuredAt": {
      "desktop": "1440px",
      "mobile": "390px"
    },
    "breakpoints": "tokens/00-foundation/breakpoint.json",
    "desktop": {
      "heightPx": 2335,
      "columns": 1,
      "heightSource": "max over routes of extraction/measured-values.json sectionHeights (1440px, built clone)"
    },
    "mobile": {
      "heightPx": 5145,
      "columns": 1,
      "hiddenShare": 0
    },
    "changes": [
      "grows taller on mobile (content stacks)"
    ]
  },
  "assetRoles": [],
  "implementedBy": "src/sections/ContentSection2.jsx",
  "semantic": {
    "id": "content.legal-clause",
    "category": "CONTENT"
  },
  "source": {
    "id": "ContentSection2",
    "tag": "h3",
    "file": "src/sections/ContentSection2.jsx",
    "lines": [
      33,
      37
    ]
  },
  "retrievalEligible": true,
  "generatedAssetRoles": []
}
