{
  "id": "content.open-roles-section",
  "category": "CONTENT",
  "label": "Open Roles Section",
  "tag": "section",
  "purpose": "Carries the substantive content of the page. Example headline: \"Open roles\".",
  "purposeIsInferred": true,
  "nameSource": "data-attr",
  "evidence": {
    "level": "measured",
    "instances": 1,
    "routes": 1,
    "measuredFrom": [
      "src/sections/OpenRolesSection.jsx:4-42"
    ],
    "measuredIn": "the runnable clone's own source (src/sections/*.jsx); see extraction/measured-values.json"
  },
  "content": {
    "additionalProperties": false,
    "fields": {
      "heading": {
        "type": "string",
        "required": true,
        "maxWords": 2
      },
      "subheading": {
        "type": "string",
        "required": true,
        "maxWords": 4
      },
      "body": {
        "type": "string[]",
        "required": true,
        "maxItems": 3,
        "maxWords": 7
      }
    }
  },
  "constraints": {
    "onePerPage": true
  },
  "motion": {
    "allowedPatterns": [
      "appear-on-enter",
      "none"
    ],
    "reducedMotionFallback": "disable-animation"
  },
  "responsive": {
    "measuredAt": {
      "desktop": "1440px",
      "mobile": "390px"
    },
    "breakpoints": "tokens/00-foundation/breakpoint.json",
    "desktop": {
      "heightPx": 525,
      "columns": 3,
      "heightSource": "max over routes of extraction/measured-values.json sectionHeights (1440px, built clone)"
    },
    "mobile": {
      "heightPx": 341,
      "columns": 2,
      "hiddenShare": 0
    },
    "changes": [
      "columns change from 3 to 2"
    ]
  },
  "assetRoles": [],
  "implementedBy": "src/sections/OpenRolesSection.jsx",
  "semantic": {
    "id": "content.open-roles-section",
    "category": "CONTENT"
  },
  "source": {
    "id": "OpenRolesSection",
    "tag": "section",
    "file": "src/sections/OpenRolesSection.jsx",
    "lines": [
      4,
      42
    ]
  },
  "retrievalEligible": true,
  "generatedAssetRoles": []
}
