{
  "id": "features.integrations-section",
  "category": "FEATURES",
  "label": "Integrations Section",
  "tag": "section",
  "purpose": "Explains what the product does and why it matters. Example headline: \"No rip-and-replace required\".",
  "purposeIsInferred": true,
  "nameSource": "data-attr",
  "evidence": {
    "level": "measured",
    "instances": 1,
    "routes": 1,
    "measuredFrom": [
      "src/sections/IntegrationsSection.jsx:4-132"
    ],
    "measuredIn": "the runnable clone's own source (src/sections/*.jsx); see extraction/measured-values.json"
  },
  "content": {
    "additionalProperties": false,
    "fields": {
      "heading": {
        "type": "string",
        "required": true,
        "maxWords": 3
      },
      "body": {
        "type": "string[]",
        "required": true,
        "maxItems": 1,
        "maxWords": 16
      },
      "images": {
        "type": "image[]",
        "required": false,
        "maxItems": 12,
        "assetRoles": [
          "integration-logo"
        ]
      }
    }
  },
  "constraints": {
    "onePerPage": true
  },
  "motion": {
    "allowedPatterns": [
      "none"
    ],
    "reducedMotionFallback": "disable-animation"
  },
  "responsive": {
    "measuredAt": {
      "desktop": "1440px",
      "mobile": "390px"
    },
    "breakpoints": "tokens/00-foundation/breakpoint.json",
    "desktop": {
      "heightPx": 578,
      "columns": 6,
      "heightSource": "max over routes of extraction/measured-values.json sectionHeights (1440px, built clone)"
    },
    "mobile": {
      "heightPx": 789,
      "columns": 2,
      "hiddenShare": 0
    },
    "changes": [
      "columns change from 6 to 2",
      "grows taller on mobile (content stacks)"
    ]
  },
  "assetRoles": [
    "integration-logo"
  ],
  "contentPolicy": "Measured logos name real third-party integration partners (accounting, payments and ERP platforms the product connects to). Generated pages must never reproduce or fabricate a real company's mark; use explicit integration-logo placeholders.",
  "implementedBy": "src/sections/IntegrationsSection.jsx",
  "semantic": {
    "id": "features.integrations-section",
    "category": "FEATURES"
  },
  "source": {
    "id": "IntegrationsSection",
    "tag": "section",
    "file": "src/sections/IntegrationsSection.jsx",
    "lines": [
      4,
      132
    ]
  },
  "retrievalEligible": true,
  "generatedAssetRoles": [
    "placeholder-company-logo"
  ]
}
