{
  "id": "content.white",
  "category": "CONTENT",
  "label": "White",
  "tag": "div",
  "purpose": "Decorative full-bleed white background layer behind the contact form pages (empty element, absolutely positioned).",
  "purposeIsInferred": false,
  "nameSource": "data-attr",
  "evidence": {
    "level": "measured",
    "instances": 2,
    "routes": 2,
    "measuredFrom": [
      "src/sections/White.jsx:4-4"
    ],
    "measuredIn": "the runnable clone's own source (src/sections/*.jsx); see extraction/measured-values.json"
  },
  "content": {
    "additionalProperties": false,
    "fields": {}
  },
  "constraints": {
    "onePerPage": true
  },
  "motion": {
    "allowedPatterns": [
      "none"
    ],
    "reducedMotionFallback": "disable-animation"
  },
  "responsive": {
    "measuredAt": {
      "desktop": "1440px",
      "mobile": "390px"
    },
    "breakpoints": "tokens/00-foundation/breakpoint.json",
    "desktop": {
      "heightPx": 1991,
      "columns": 1,
      "heightSource": "max over routes of extraction/measured-values.json sectionHeights (1440px, built clone)"
    },
    "mobile": {
      "heightPx": null,
      "columns": null,
      "hiddenShare": 0
    },
    "changes": []
  },
  "assetRoles": [],
  "implementedBy": "src/sections/White.jsx",
  "semantic": {
    "id": "content.white",
    "category": "CONTENT"
  },
  "source": {
    "id": "White",
    "tag": "div",
    "file": "src/sections/White.jsx",
    "lines": [
      4,
      4
    ]
  },
  "retrievalEligible": false,
  "retrievalIneligibleReason": "Empty full-bleed background layer (absolutely positioned, no text or media) behind the contact form pages; carries no retrievable content.",
  "generatedAssetRoles": []
}
