{
  "id": "shell.desktop",
  "category": "SHELL",
  "label": "Desktop",
  "tag": "footer",
  "purpose": "Orients the visitor and provides navigation or site-wide links; carried across pages. Example headline: \"Getting you from \"sent\" to \"paid\", your way.\".",
  "purposeIsInferred": true,
  "nameSource": "data-attr",
  "evidence": {
    "level": "measured",
    "instances": 2,
    "routes": 2,
    "measuredFrom": [
      "src/sections/Desktop.jsx:6-160"
    ],
    "measuredIn": "the runnable clone's own source (src/sections/*.jsx); see extraction/measured-values.json"
  },
  "content": {
    "additionalProperties": false,
    "fields": {
      "heading": {
        "type": "string",
        "required": true,
        "maxWords": 8
      },
      "body": {
        "type": "string[]",
        "required": true,
        "maxItems": 21,
        "maxWords": 8
      },
      "ctas": {
        "type": "cta[]",
        "required": true,
        "maxItems": 17,
        "maxWords": 3
      },
      "images": {
        "type": "image[]",
        "required": false,
        "maxItems": 2,
        "assetRoles": [
          "logo",
          "compliance-badge"
        ]
      }
    }
  },
  "constraints": {
    "onePerPage": true
  },
  "motion": {
    "allowedPatterns": [
      "none"
    ],
    "reducedMotionFallback": "disable-animation"
  },
  "responsive": {
    "measuredAt": {
      "desktop": "1440px",
      "mobile": "390px"
    },
    "breakpoints": "tokens/00-foundation/breakpoint.json",
    "desktop": {
      "heightPx": 818,
      "columns": 1,
      "heightSource": "max over routes of extraction/measured-values.json sectionHeights (1440px, built clone)"
    },
    "mobile": {
      "heightPx": null,
      "columns": null,
      "hiddenShare": 0
    },
    "changes": []
  },
  "assetRoles": [
    "logo",
    "compliance-badge"
  ],
  "contentPolicy": "Carries the site's own brand mark (the Exante wordmark) alongside other footer imagery. Generated pages must swap in the generated business's own logo for the logo slot; never reuse the measured mark.",
  "implementedBy": "src/sections/Desktop.jsx",
  "semantic": {
    "id": "shell.desktop",
    "category": "SHELL"
  },
  "source": {
    "id": "Desktop",
    "tag": "footer",
    "file": "src/sections/Desktop.jsx",
    "lines": [
      6,
      160
    ]
  },
  "retrievalEligible": true,
  "generatedAssetRoles": [
    "placeholder-brand-mark",
    "user-supplied-asset"
  ]
}
