{
  "id": "features.featured-image-wrapper",
  "category": "CONTENT",
  "label": "Featured Image Wrapper",
  "tag": "div",
  "purpose": "The article's featured image, directly under the article header (editorial, not a feature block).",
  "purposeIsInferred": false,
  "nameSource": "data-attr",
  "evidence": {
    "level": "measured",
    "instances": 8,
    "routes": 8,
    "measuredFrom": [
      "src/sections/FeaturedImageWrapper.jsx:4-12",
      "src/sections/FeaturedImageWrapper2.jsx:4-12",
      "src/sections/FeaturedImageWrapper3.jsx:4-12",
      "src/sections/FeaturedImageWrapper4.jsx:4-12",
      "src/sections/FeaturedImageWrapper5.jsx:4-12"
    ],
    "measuredIn": "the runnable clone's own source (src/sections/*.jsx); see extraction/measured-values.json"
  },
  "content": {
    "additionalProperties": false,
    "fields": {
      "images": {
        "type": "image[]",
        "required": false,
        "maxItems": 1,
        "assetRoles": [
          "content-image"
        ]
      }
    }
  },
  "constraints": {
    "onePerPage": true
  },
  "motion": {
    "allowedPatterns": [
      "appear-on-enter",
      "none"
    ],
    "reducedMotionFallback": "disable-animation"
  },
  "responsive": {
    "measuredAt": {
      "desktop": "1440px",
      "mobile": "390px"
    },
    "breakpoints": "tokens/00-foundation/breakpoint.json",
    "desktop": {
      "heightPx": 760,
      "columns": 1,
      "heightSource": "max over routes of extraction/measured-values.json sectionHeights (1440px, built clone)"
    },
    "mobile": {
      "heightPx": 196,
      "columns": 1,
      "hiddenShare": 0
    },
    "changes": []
  },
  "assetRoles": [
    "content-image"
  ],
  "implementedBy": "src/sections/FeaturedImageWrapper.jsx",
  "semantic": {
    "id": "features.featured-image-wrapper",
    "category": "CONTENT"
  },
  "source": {
    "id": "FeaturedImageWrapper",
    "tag": "div",
    "file": "src/sections/FeaturedImageWrapper.jsx",
    "lines": [
      4,
      12
    ]
  },
  "retrievalEligible": true,
  "generatedAssetRoles": [
    "generated-illustration",
    "placeholder-screenshot",
    "user-supplied-asset"
  ]
}
