{
  "id": "content.problem-section",
  "category": "CONTENT",
  "label": "Problem Section",
  "tag": "section",
  "purpose": "Carries the substantive content of the page. Example headline: \"Your collections process can't scale, and it's costing you\".",
  "purposeIsInferred": true,
  "nameSource": "data-attr",
  "evidence": {
    "level": "measured",
    "instances": 1,
    "routes": 1,
    "measuredFrom": [
      "src/sections/ProblemSection.jsx:4-144"
    ],
    "measuredIn": "the runnable clone's own source (src/sections/*.jsx); see extraction/measured-values.json"
  },
  "content": {
    "additionalProperties": false,
    "fields": {
      "heading": {
        "type": "string",
        "required": true,
        "maxWords": 9
      },
      "body": {
        "type": "string[]",
        "required": true,
        "maxItems": 1,
        "maxWords": 2
      },
      "items": {
        "type": "item[]",
        "required": true,
        "maxItems": 3,
        "titleMaxWords": 2,
        "bodyMaxWords": 16
      }
    }
  },
  "constraints": {
    "onePerPage": true
  },
  "motion": {
    "allowedPatterns": [
      "none"
    ],
    "reducedMotionFallback": "disable-animation"
  },
  "responsive": {
    "measuredAt": {
      "desktop": "1440px",
      "mobile": "390px"
    },
    "breakpoints": "tokens/00-foundation/breakpoint.json",
    "desktop": {
      "heightPx": 779,
      "columns": 3,
      "heightSource": "max over routes of extraction/measured-values.json sectionHeights (1440px, built clone)"
    },
    "mobile": {
      "heightPx": 897,
      "columns": 1,
      "hiddenShare": 0
    },
    "changes": [
      "3 columns collapse to a single column"
    ]
  },
  "assetRoles": [],
  "implementedBy": "src/sections/ProblemSection.jsx",
  "semantic": {
    "id": "content.problem-section",
    "category": "CONTENT"
  },
  "source": {
    "id": "ProblemSection",
    "tag": "section",
    "file": "src/sections/ProblemSection.jsx",
    "lines": [
      4,
      144
    ]
  },
  "retrievalEligible": true,
  "generatedAssetRoles": []
}
