{
  "id": "content.container",
  "category": "CONTENT",
  "label": "Container",
  "tag": "div",
  "purpose": "Carries the substantive content of the page. Example headline: \"Agents That Learn How You Work (Not Software You Have to Learn)\".",
  "purposeIsInferred": true,
  "nameSource": "data-attr",
  "evidence": {
    "level": "measured",
    "instances": 8,
    "routes": 8,
    "measuredFrom": [
      "src/sections/Container.jsx:4-108",
      "src/sections/Container2.jsx:4-107",
      "src/sections/Container3.jsx:4-114",
      "src/sections/Container4.jsx:4-103",
      "src/sections/Container5.jsx:4-98"
    ],
    "measuredIn": "the runnable clone's own source (src/sections/*.jsx); see extraction/measured-values.json"
  },
  "content": {
    "additionalProperties": false,
    "fields": {
      "heading": {
        "type": "string",
        "required": true,
        "maxWords": 12
      },
      "body": {
        "type": "string[]",
        "required": true,
        "maxItems": 8,
        "maxWords": 27
      },
      "images": {
        "type": "image[]",
        "required": false,
        "maxItems": 1,
        "assetRoles": [
          "content-image",
          "avatar"
        ]
      }
    }
  },
  "constraints": {
    "onePerPage": true
  },
  "motion": {
    "allowedPatterns": [
      "appear-on-enter",
      "none"
    ],
    "reducedMotionFallback": "disable-animation"
  },
  "responsive": {
    "measuredAt": {
      "desktop": "1440px",
      "mobile": "390px"
    },
    "breakpoints": "tokens/00-foundation/breakpoint.json",
    "desktop": {
      "heightPx": 535,
      "columns": 3,
      "heightSource": "max over routes of extraction/measured-values.json sectionHeights (1440px, built clone)"
    },
    "mobile": {
      "heightPx": 514,
      "columns": 3,
      "hiddenShare": 0
    },
    "changes": []
  },
  "assetRoles": [
    "content-image",
    "avatar"
  ],
  "implementedBy": "src/sections/Container.jsx",
  "semantic": {
    "id": "content.container",
    "category": "CONTENT"
  },
  "source": {
    "id": "Container",
    "tag": "div",
    "file": "src/sections/Container.jsx",
    "lines": [
      4,
      108
    ]
  },
  "retrievalEligible": true,
  "generatedAssetRoles": [
    "fictional-avatar",
    "generated-illustration",
    "placeholder-screenshot",
    "user-supplied-asset"
  ]
}
