{
  "id": "content.framer-39uowv-container",
  "category": "SHELL",
  "label": "framer-39uowv-container",
  "tag": "div",
  "purpose": "Site footer: tagline, link columns (features, company, legal), the compliance badge and social links.",
  "purposeIsInferred": false,
  "nameSource": "class",
  "evidence": {
    "level": "measured",
    "instances": 1,
    "routes": 1,
    "measuredFrom": [
      "src/sections/Framer39uowvContainer.jsx:6-164"
    ],
    "measuredIn": "the runnable clone's own source (src/sections/*.jsx); see extraction/measured-values.json"
  },
  "content": {
    "additionalProperties": false,
    "fields": {
      "heading": {
        "type": "string",
        "required": true,
        "maxWords": 8
      },
      "body": {
        "type": "string[]",
        "required": true,
        "maxItems": 21,
        "maxWords": 8
      },
      "images": {
        "type": "image[]",
        "required": false,
        "maxItems": 1,
        "assetRoles": [
          "logo",
          "compliance-badge"
        ]
      }
    }
  },
  "constraints": {
    "onePerPage": true,
    "mustBeLast": true
  },
  "motion": {
    "allowedPatterns": [
      "none"
    ],
    "reducedMotionFallback": "disable-animation"
  },
  "responsive": {
    "measuredAt": {
      "desktop": "1440px",
      "mobile": "390px"
    },
    "breakpoints": "tokens/00-foundation/breakpoint.json",
    "desktop": {
      "heightPx": 818,
      "columns": 1,
      "heightSource": "max over routes of extraction/measured-values.json sectionHeights (1440px, built clone)"
    },
    "mobile": {
      "heightPx": 1260,
      "columns": 1,
      "hiddenShare": 0
    },
    "changes": [
      "grows taller on mobile (content stacks)"
    ]
  },
  "assetRoles": [
    "logo",
    "compliance-badge"
  ],
  "implementedBy": "src/sections/Framer39uowvContainer.jsx",
  "semantic": {
    "id": "content.framer-39uowv-container",
    "category": "SHELL"
  },
  "source": {
    "id": "Framer39uowvContainer",
    "tag": "div",
    "file": "src/sections/Framer39uowvContainer.jsx",
    "lines": [
      6,
      164
    ]
  },
  "retrievalEligible": true,
  "generatedAssetRoles": [
    "placeholder-brand-mark",
    "user-supplied-asset"
  ]
}
