{
  "id": "content.framer-guhhla-container",
  "category": "SHELL",
  "label": "framer-guhhla-container",
  "tag": "div",
  "purpose": "Site header: fixed top navigation bar with the brand mark, product/company dropdown menus and the sign-in and demo-request buttons.",
  "purposeIsInferred": false,
  "nameSource": "class",
  "evidence": {
    "level": "measured",
    "instances": 2,
    "routes": 2,
    "measuredFrom": [
      "src/sections/FramerGuhhlaContainer.jsx:6-275",
      "src/sections/FramerGuhhlaContainer2.jsx:6-66"
    ],
    "measuredIn": "the runnable clone's own source (src/sections/*.jsx); see extraction/measured-values.json"
  },
  "content": {
    "additionalProperties": false,
    "fields": {
      "body": {
        "type": "string[]",
        "required": true,
        "maxItems": 4,
        "maxWords": 3
      },
      "ctas": {
        "type": "cta[]",
        "required": true,
        "maxItems": 2,
        "maxWords": 3
      }
    }
  },
  "constraints": {
    "onePerPage": true,
    "mustBeFirst": true
  },
  "motion": {
    "allowedPatterns": [
      "none"
    ],
    "reducedMotionFallback": "disable-animation"
  },
  "responsive": {
    "measuredAt": {
      "desktop": "1440px",
      "mobile": "390px"
    },
    "breakpoints": "tokens/00-foundation/breakpoint.json",
    "desktop": {
      "heightPx": 72,
      "columns": 2,
      "heightSource": "max over routes of extraction/measured-values.json sectionHeights (1440px, built clone)"
    },
    "mobile": {
      "heightPx": 64,
      "columns": 1,
      "hiddenShare": 0
    },
    "changes": [
      "2 columns collapse to a single column"
    ]
  },
  "assetRoles": [],
  "implementedBy": "src/sections/FramerGuhhlaContainer.jsx",
  "semantic": {
    "id": "content.framer-guhhla-container",
    "category": "SHELL"
  },
  "source": {
    "id": "FramerGuhhlaContainer",
    "tag": "div",
    "file": "src/sections/FramerGuhhlaContainer.jsx",
    "lines": [
      6,
      275
    ]
  },
  "retrievalEligible": true,
  "generatedAssetRoles": []
}
