{
  "id": "content.team-members-section",
  "category": "CONTENT",
  "label": "Team Members Section",
  "tag": "section",
  "purpose": "Carries the substantive content of the page. Example headline: \"Built by a team with deep finance, engineering, and enterprise experience\".",
  "purposeIsInferred": true,
  "nameSource": "data-attr",
  "evidence": {
    "level": "measured",
    "instances": 3,
    "routes": 2,
    "measuredFrom": [
      "src/sections/TeamMembersSection.jsx:4-209",
      "src/sections/TeamMembersSection2.jsx:4-103",
      "src/sections/TeamMembersSection3.jsx:4-131"
    ],
    "measuredIn": "the runnable clone's own source (src/sections/*.jsx); see extraction/measured-values.json"
  },
  "content": {
    "additionalProperties": false,
    "fields": {
      "heading": {
        "type": "string",
        "required": true,
        "maxWords": 11
      },
      "subheading": {
        "type": "string",
        "required": false,
        "maxWords": 29
      },
      "body": {
        "type": "string[]",
        "required": false,
        "maxItems": 8,
        "maxWords": 32
      },
      "ctas": {
        "type": "cta[]",
        "required": false,
        "maxItems": 1,
        "maxWords": 5
      },
      "images": {
        "type": "image[]",
        "required": false,
        "maxItems": 12,
        "assetRoles": [
          "avatar",
          "credential-logo",
          "content-image",
          "icon"
        ]
      }
    }
  },
  "constraints": {
    "maxPerPage": 2
  },
  "motion": {
    "allowedPatterns": [
      "none"
    ],
    "reducedMotionFallback": "disable-animation"
  },
  "responsive": {
    "measuredAt": {
      "desktop": "1440px",
      "mobile": "390px"
    },
    "breakpoints": "tokens/00-foundation/breakpoint.json",
    "desktop": {
      "heightPx": 1489,
      "columns": 8,
      "heightSource": "max over routes of extraction/measured-values.json sectionHeights (1440px, built clone)"
    },
    "mobile": {
      "heightPx": 1501,
      "columns": 2,
      "hiddenShare": 0
    },
    "changes": [
      "columns change from 8 to 2"
    ]
  },
  "assetRoles": [
    "avatar",
    "credential-logo",
    "content-image",
    "icon"
  ],
  "contentPolicy": "Measured photos include real team members' headshots and real companies'/institutions' logos used as team credentials, alongside decorative imagery. Generated pages must never generate or reuse a real person's likeness for the avatar slots, or a real company's or institution's mark for the credential-logo slots; use neutral placeholders for both.",
  "implementedBy": "src/sections/TeamMembersSection.jsx",
  "semantic": {
    "id": "content.team-members-section",
    "category": "CONTENT"
  },
  "source": {
    "id": "TeamMembersSection",
    "tag": "section",
    "file": "src/sections/TeamMembersSection.jsx",
    "lines": [
      4,
      209
    ]
  },
  "retrievalEligible": true,
  "generatedAssetRoles": [
    "fictional-avatar",
    "generated-illustration",
    "icon",
    "placeholder-company-logo",
    "placeholder-screenshot",
    "user-supplied-asset"
  ]
}
