{
  "id": "hero.hero-section",
  "category": "HERO",
  "label": "Hero Section",
  "tag": "section",
  "purpose": "Opens the page: states the offer in an h1 and gives the first call to action. Example headline: \"AI teammate that handles collections\".",
  "purposeIsInferred": true,
  "nameSource": "data-attr",
  "evidence": {
    "level": "measured",
    "instances": 8,
    "routes": 8,
    "measuredFrom": [
      "src/sections/HeroSection.jsx:6-50",
      "src/sections/HeroSection2.jsx:4-29",
      "src/sections/HeroSection3.jsx:4-26",
      "src/sections/HeroSection4.jsx:4-69",
      "src/sections/HeroSection5.jsx:4-41"
    ],
    "measuredIn": "the runnable clone's own source (src/sections/*.jsx); see extraction/measured-values.json"
  },
  "content": {
    "additionalProperties": false,
    "fields": {
      "heading": {
        "type": "string",
        "required": true,
        "maxWords": 7
      },
      "body": {
        "type": "string[]",
        "required": false,
        "maxItems": 3,
        "maxWords": 38
      },
      "ctas": {
        "type": "cta[]",
        "required": false,
        "maxItems": 2,
        "maxWords": 3
      },
      "images": {
        "type": "image[]",
        "required": false,
        "maxItems": 2,
        "assetRoles": [
          "hero-image"
        ]
      }
    }
  },
  "constraints": {
    "onePerPage": true
  },
  "motion": {
    "allowedPatterns": [
      "appear-on-enter",
      "none",
      "scroll-linked"
    ],
    "reducedMotionFallback": "disable-animation"
  },
  "responsive": {
    "measuredAt": {
      "desktop": "1440px",
      "mobile": "390px"
    },
    "breakpoints": "tokens/00-foundation/breakpoint.json",
    "desktop": {
      "heightPx": 900,
      "columns": 1,
      "heightSource": "max over routes of extraction/measured-values.json sectionHeights (1440px, built clone)"
    },
    "mobile": {
      "heightPx": 844,
      "columns": 1,
      "hiddenShare": 0
    },
    "changes": []
  },
  "assetRoles": [
    "hero-image"
  ],
  "implementedBy": "src/sections/HeroSection.jsx",
  "semantic": {
    "id": "hero.hero-section",
    "category": "HERO"
  },
  "source": {
    "id": "HeroSection",
    "tag": "section",
    "file": "src/sections/HeroSection.jsx",
    "lines": [
      6,
      50
    ]
  },
  "retrievalEligible": true,
  "generatedAssetRoles": [
    "generated-illustration",
    "placeholder-screenshot",
    "user-supplied-asset"
  ]
}
